<?xml version="1.0" encoding="UTF-8"?>
<test xmlns="http://www.example.org/GTDL_schema" 
xmlns:xsi="http://www.w3.org/2001/XMLSchema-instance" 
xsi:schemaLocation="http://www.example.org/GTDL_schema GTDL_schema.xsd ">
  <input>
  	<pluginId></pluginId>
  	<inputData></inputData>
  </input>
  <output>
  	<result>
  		<resource>se.reef.man.poznan.pl</resource>
  		<date>2009-02-06 14:33:36</date>
  		<simpleTest>Tomcat</simpleTest>
  		<BESStatusType></BESStatusType>
  		<!-- stringResult></stringResult-->
  		<resultSummary></resultSummary>
  		<resultType></resultType>
  		<resultData></resultData>
  	</result>
  </output>
</test>
